doc_id,table_id,row_index,ColumnA,ColumnB,ColumnC,ColumnD,ColumnE,ColumnF,ColumnG
WHO_TB_handbook_module3_diagnosis_2025,Table 2.13.,1,,Manufacturer,Antigen,Key workflow consideration,Incubation time,Required equipment,Staff requirements
WHO_TB_handbook_module3_diagnosis_2025,Table 2.13.,2,QuantiFERON® - TB Gold Plus (ELISA),QIAGEN,ESAT-6 and CFP- 10 simulating peptides,Third- party ELISA reader required,16– 24 hours,Incubator Centrifuge Plate washer and agitator ELISA reader,"Phlebotomist, technician trained to perform ELISA"
WHO_TB_handbook_module3_diagnosis_2025,Table 2.13.,3,Wantai TB- IGRA (ELISA),Beijing Wantai Biological Pharmacy Enterprise Co Ltd,Recombinant fusion protein of CFP-10 and ESAT- 6,Third- party ELISA reader required,20– 24 hours,Incubator Centrifuge Plate washer and agitator ELISA reader,"Phlebotomist, technician trained to perform ELISA"
WHO_TB_handbook_module3_diagnosis_2025,Table 2.13.,4,T- SPOT.TB (ELISPOT),Oxford Immunotec,ESAT-6 and CFP- 10 simulating peptides,Separation of blood cells should be performed in a Level II biosafety cabinet,16– 20 hours,Lymphocyte counter Humidified incubator with a 5 % CO 2 Centrifuge Plate washer and agitator ELISPOT reader,"Phlebotomist, technician trained to perform ELISPOT"
WHO_TB_handbook_module3_diagnosis_2025,Table 2.13.,5,STANDARD E TB- Feron (ELISA),SD Biosensor,"Recombinant proteins of ESAT-6, CFP- 10 and TB7.7",Third- party ELISA reader required,16– 20 hours,Incubator Centrifuge Plate washer and agitator ELISA reader,"Phlebotomist, technician trained to perform ELISA"
WHO_TB_handbook_module3_diagnosis_2025,Table 2.13.,6,LIAISON QFT- PLUS (CLIA),Diasorin and Qiagen,Peptide cocktail of ESAT-6 and CFP- 10,LIAISON CLIA analyser can be used for other diseases as well,16– 20 hours,Incubator Centrifuge LIAISON CLIA analyser,"Phlebotomist, technician trained in CLIA techniques"