doc_id,table_id,row_index,ColumnA,ColumnB,ColumnC
WHO_TB_handbook_module5_pediatrics_2022,Table 5.17.,1,Specialist,Role during and after treatment to prevent morbidity,
WHO_TB_handbook_module5_pediatrics_2022,Table 5.17.,2,Clinician,"Look for contractures, joint destructions and recurrent TB Repeat X-ray every 3 months (as clinically indicated) and at end of treatment to assess joint integrity Long-term follow-up for spinal TB for further collapse until age 18 years",
WHO_TB_handbook_module5_pediatrics_2022,Table 5.17.,3,Specialist,Role during and after treatment to prevent morbidity,
WHO_TB_handbook_module5_pediatrics_2022,Table 5.17.,4,Physiotherapist,From diagnosis to maintain range of motion and prevent contractures,
WHO_TB_handbook_module5_pediatrics_2022,Table 5.17.,5,Occupational therapist,Provide night splints to immobilize joints in functional positions,
WHO_TB_handbook_module5_pediatrics_2022,Table 5.17.,6,Dietician,Improve nutrition Give vitamin D and multivitamins,